,MATCH_TITLE,VENUE,LINK
1,"Bangladesh vs Sri Lanka,","at Abu Dhabi, Sheikh Zayed Stadium",https://www.cricbuzz.com/live-cricket-scores/130058/ban-vs-sl-5th-match-group-b-asia-cup-2025
2,"India vs Pakistan,","at Dubai, Dubai International Cricket Stadium",https://www.cricbuzz.com/live-cricket-scores/130069/ind-vs-pak-6th-match-group-a-asia-cup-2025
3,"United Arab Emirates vs Oman,","at Abu Dhabi, Sheikh Zayed Stadium",https://www.cricbuzz.com/live-cricket-scores/130074/uae-vs-oman-7th-match-group-a-asia-cup-2025
4,"Sri Lanka vs Hong Kong,","at Dubai, Dubai International Cricket Stadium",https://www.cricbuzz.com/live-cricket-scores/130080/sl-vs-hk-8th-match-group-b-asia-cup-2025
5,"Bangladesh vs Afghanistan,","at Abu Dhabi, Sheikh Zayed Stadium",https://www.cricbuzz.com/live-cricket-scores/130085/ban-vs-afg-9th-match-group-b-asia-cup-2025
6,"Pakistan vs United Arab Emirates,","at Dubai, Dubai International Cricket Stadium",https://www.cricbuzz.com/live-cricket-scores/130096/pak-vs-uae-10th-match-group-a-asia-cup-2025
7,"Sri Lanka vs Afghanistan,","at Abu Dhabi, Sheikh Zayed Stadium",https://www.cricbuzz.com/live-cricket-scores/130102/sl-vs-afg-11th-match-group-b-asia-cup-2025
8,"India vs Oman,","at Abu Dhabi, Sheikh Zayed Stadium",https://www.cricbuzz.com/live-cricket-scores/130113/ind-vs-oman-12th-match-group-a-asia-cup-2025
9,"England vs South Africa,","at Nottingham, Trent Bridge",https://www.cricbuzz.com/live-cricket-scores/105812/eng-vs-rsa-3rd-t20i-south-africa-tour-of-england-2025
10,"Ireland vs England,","at Dublin, The Village",https://www.cricbuzz.com/live-cricket-scores/105844/ire-vs-eng-1st-t20i-england-tour-of-ireland-2025
11,"Ireland vs England,","at Dublin, The Village",https://www.cricbuzz.com/live-cricket-scores/105850/ire-vs-eng-2nd-t20i-england-tour-of-ireland-2025
12,"Eswatini vs Mozambique,","at Malkerns, Malkerns Country Club oval",https://www.cricbuzz.com/live-cricket-scores/134694/swt-vs-moz-4th-t20i-mozambique-tour-of-eswatini-2025
13,"Eswatini vs Mozambique,","at Malkerns, Malkerns Country Club oval",https://www.cricbuzz.com/live-cricket-scores/134705/swt-vs-moz-5th-t20i-mozambique-tour-of-eswatini-2025
14,"Zimbabwe vs Namibia,","at Bulawayo, Queens Sports Club",https://www.cricbuzz.com/live-cricket-scores/134711/zim-vs-nam-1st-t20i-namibia-tour-of-zimbabwe-2025
15,"Zimbabwe vs Namibia,","at Bulawayo, Queens Sports Club",https://www.cricbuzz.com/live-cricket-scores/134722/zim-vs-nam-2nd-t20i-namibia-tour-of-zimbabwe-2025
16,"Zimbabwe vs Namibia,","at Bulawayo, Queens Sports Club",https://www.cricbuzz.com/live-cricket-scores/134733/zim-vs-nam-3rd-t20i-namibia-tour-of-zimbabwe-2025
17,"Guyana Amazon Warriors vs Saint Lucia Kings,","at Guyana, Providence Stadium",https://www.cricbuzz.com/live-cricket-scores/116801/gaw-vs-slk-29th-match-caribbean-premier-league-2025
18,"Guyana Amazon Warriors vs Barbados Royals,","at Guyana, Providence Stadium",https://www.cricbuzz.com/live-cricket-scores/116810/gaw-vs-br-30th-match-caribbean-premier-league-2025
19,"TBC vs TBC,","at Guyana, Providence Stadium",https://www.cricbuzz.com/live-cricket-scores/116813/tbc-vs-tbc-eliminator-caribbean-premier-league-2025
20,"TBC vs TBC,","at Guyana, Providence Stadium",https://www.cricbuzz.com/live-cricket-scores/116819/tbc-vs-tbc-qualifier-1-caribbean-premier-league-2025
21,"TBC vs TBC,","at Guyana, Providence Stadium",https://www.cricbuzz.com/live-cricket-scores/116822/tbc-vs-tbc-qualifier-2-caribbean-premier-league-2025
22,"Northamptonshire vs Hampshire,","at Birmingham, Edgbaston",https://www.cricbuzz.com/live-cricket-scores/111093/nhnts-vs-ham-2nd-semi-final-t20-blast-2025
23,"TBC vs TBC,","at Birmingham, Edgbaston",https://www.cricbuzz.com/live-cricket-scores/111101/tbc-vs-tbc-final-t20-blast-2025
24,"New South Wales vs Tasmania,","at Sydney, Cricket Central",https://www.cricbuzz.com/live-cricket-scores/133451/nsw-vs-tas-1st-match-australia-domestic-one-day-cup-2025-26
25,"Queensland vs Victoria,","at Brisbane, Allan Border Field",https://www.cricbuzz.com/live-cricket-scores/133462/ql-vs-vic-2nd-match-australia-domestic-one-day-cup-2025-26
26,"Victoria vs Tasmania,","at Brisbane, Allan Border Field",https://www.cricbuzz.com/live-cricket-scores/133468/vic-vs-tas-3rd-match-australia-domestic-one-day-cup-2025-26
27,"New South Wales vs South Australia,","at Sydney, Cricket Central",https://www.cricbuzz.com/live-cricket-scores/133479/nsw-vs-saus-4th-match-australia-domestic-one-day-cup-2025-26
28,"India A vs Australia A,", • ,https://www.cricbuzz.com/live-cricket-scores/119843/inda-vs-ausa-1st-unofficial-test-australia-a-tour-of-india-2025
29,"Warwickshire vs Essex,", • ,https://www.cricbuzz.com/live-cricket-scores/113226/warks-vs-ess-61st-match-county-championship-division-one-2025
30,"Durham vs Worcestershire,", • ,https://www.cricbuzz.com/live-cricket-scores/113229/dur-vs-worcs-62nd-match-county-championship-division-one-2025
31,"Sussex vs Yorkshire,", • ,https://www.cricbuzz.com/live-cricket-scores/113235/sus-vs-yorks-63rd-match-county-championship-division-one-2025
32,"Surrey vs Nottinghamshire,", • ,https://www.cricbuzz.com/live-cricket-scores/113244/sur-vs-notts-64th-match-county-championship-division-one-2025
33,"Somerset vs Hampshire,", • ,https://www.cricbuzz.com/live-cricket-scores/113253/som-vs-ham-65th-match-county-championship-division-one-2025
34,"South Africa A vs New Zealand A,", • ,https://www.cricbuzz.com/live-cricket-scores/116498/rsaa-vs-nza-2nd-unofficial-test-new-zealand-a-tour-of-south-africa-2025
35,"Worcestershire vs Hampshire,","at Nottingham, Trent Bridge",https://www.cricbuzz.com/live-cricket-scores/111985/worcs-vs-ham-final-england-domestic-one-day-cup-2025
36,"Leicestershire vs Kent,", • ,https://www.cricbuzz.com/live-cricket-scores/113631/leic-vs-kent-49th-match-county-championship-division-two-2025
37,"Lancashire vs Middlesex,", • ,https://www.cricbuzz.com/live-cricket-scores/113634/lancs-vs-mdx-50th-match-county-championship-division-two-2025
38,"Gloucestershire vs Northamptonshire,", • ,https://www.cricbuzz.com/live-cricket-scores/113640/gloucs-vs-nhnts-51st-match-county-championship-division-two-2025
39,"Derbyshire vs Glamorgan,", • ,https://www.cricbuzz.com/live-cricket-scores/113649/derby-vs-glam-52nd-match-county-championship-division-two-2025
40,"India Women vs Australia Women,","at New Chandigarh, Maharaja Yadavindra Singh International Cricket Stadium, Mullanpur",https://www.cricbuzz.com/live-cricket-scores/119819/indw-vs-ausw-1st-odi-australia-women-tour-of-india-2025
41,"India Women vs Australia Women,","at New Chandigarh, Maharaja Yadavindra Singh International Cricket Stadium, Mullanpur",https://www.cricbuzz.com/live-cricket-scores/119825/indw-vs-ausw-2nd-odi-australia-women-tour-of-india-2025
42,"India Women vs Australia Women,","at Delhi, Arun Jaitley Stadium",https://www.cricbuzz.com/live-cricket-scores/119834/indw-vs-ausw-3rd-odi-australia-women-tour-of-india-2025
43,"TBC vs TBC,","at Suva, Albert Park 1",https://www.cricbuzz.com/live-cricket-scores/131856/tbc-vs-tbc-5th-place-play-off-icc-womens-t20-world-cup-east-asia-pacific-qualifier-2025
44,"TBC vs TBC,","at Suva, Albert Park 2",https://www.cricbuzz.com/live-cricket-scores/131867/tbc-vs-tbc-7th-place-play-off-icc-womens-t20-world-cup-east-asia-pacific-qualifier-2025
45,"TBC vs TBC,","at Suva, Albert Park 1",https://www.cricbuzz.com/live-cricket-scores/131873/tbc-vs-tbc-final-icc-womens-t20-world-cup-east-asia-pacific-qualifier-2025
46,"TBC vs TBC,","at Suva, Albert Park 2",https://www.cricbuzz.com/live-cricket-scores/131884/tbc-vs-tbc-3rd-place-play-off-icc-womens-t20-world-cup-east-asia-pacific-qualifier-2025
47,"Austria Women vs Switzerland Women,","at Walferdange, Pierre Werner Cricket Ground",https://www.cricbuzz.com/live-cricket-scores/133831/autw-vs-suiw-3rd-match-luxembourg-womens-t20i-tri-series-2025
48,"TBC vs TBC,","at Walferdange, Pierre Werner Cricket Ground",https://www.cricbuzz.com/live-cricket-scores/133836/tbc-vs-tbc-3rd-place-play-off-luxembourg-womens-t20i-tri-series-2025
49,"TBC vs TBC,","at Walferdange, Pierre Werner Cricket Ground",https://www.cricbuzz.com/live-cricket-scores/133847/tbc-vs-tbc-final-luxembourg-womens-t20i-tri-series-2025
50,"Pakistan Women vs South Africa Women,","at Lahore, Gaddafi Stadium",https://www.cricbuzz.com/live-cricket-scores/133688/pakw-vs-rsaw-1st-odi-south-africa-women-tour-of-pakistan-2025
51,"Pakistan Women vs South Africa Women,","at Lahore, Gaddafi Stadium",https://www.cricbuzz.com/live-cricket-scores/133693/pakw-vs-rsaw-2nd-odi-south-africa-women-tour-of-pakistan-2025
52,"Guyana Amazon Warriors Women vs Trinbago Knight Riders Women,","at Guyana, Providence Stadium",https://www.cricbuzz.com/live-cricket-scores/122115/gaww-vs-tkrw-4th-match-womens-caribbean-premier-league-2025
53,"Guyana Amazon Warriors Women vs Barbados Royals Women,","at Guyana, Providence Stadium",https://www.cricbuzz.com/live-cricket-scores/122126/gaww-vs-brw-5th-match-womens-caribbean-premier-league-2025
54,"Barbados Royals Women vs Trinbago Knight Riders Women,","at Guyana, Providence Stadium",https://www.cricbuzz.com/live-cricket-scores/122137/brw-vs-tkrw-6th-match-womens-caribbean-premier-league-2025
55,"TBC vs TBC,","at Guyana, Providence Stadium",https://www.cricbuzz.com/live-cricket-scores/122148/tbc-vs-tbc-final-womens-caribbean-premier-league-2025
